user_input,retrieved_contexts,response,reference,faithfulness,context_precision,context_recall,chunk_size,chunk_overlap,retriever_k,reranker_n,use_hyde
Who can use the fast-track procedure for skilled workers in Germany?,"['3\n1.  What is the fast-track procedure for\nskilled workers?\nThe fast-track procedure for skilled workers under \nSection 81a of the Residence Act (AufenthG) ena-\nbles employers in Germany to enlist the Foreigners \nAuthority’s support to speed up the administra-\ntive procedure up to the point where the qual-\nified professional from abroad enters Germany \n(see Question 7). This new procedure was intro-\nduced under the Skilled Immigration Act. By pre-\nsenting a specific offer of employment and a letter \nof authorisation from the qualified professional \nthey wish to recruit, an employer can support their \nfuture skilled worker by initiating the fast-track \nprocedure with the competent Foreigners Author-\nity in Germany. This new procedure is optional – \nqualified professionals can continue to enter Ger-\nmany via the regular visa procedure.\nManfred Inden, Director of Eiffage \nInfra-Nordwest GmbH:\n“We made use of the fast-track \nprocedure. It saved us about six \nmonths compared to using the \nstandard procedure for recruiting \nfrom a third country.”']","Employers in Germany can use the fast-track procedure for skilled workers. They can initiate this process with the competent Foreigners Authority to recruit qualified professionals from abroad, provided they have a specific offer of employment and a letter of authorization from the professional they intend to hire.","Skilled workers with non-academic vocational qualification.Skilled workers with professional experience.Skilled workers, entering the country for qualification measures for professional recognition oras part of a recognition partnership.Apprentices in a company-based vocational training programmeVocational school students, if they are able to demonstrate that employment will follow once they have completed their school-based vocational training",1.0,0.0,0.0,1200,90,5,1,False
Who can use the fast-track procedure for skilled workers in Germany?,"['3\n1.  What is the fast-track procedure for\nskilled workers?\nThe fast-track procedure for skilled workers under \nSection 81a of the Residence Act (AufenthG) ena-\nbles employers in Germany to enlist the Foreigners \nAuthority’s support to speed up the administra-\ntive procedure up to the point where the qual-\nified professional from abroad enters Germany \n(see Question 7). This new procedure was intro-\nduced under the Skilled Immigration Act. By pre-\nsenting a specific offer of employment and a letter \nof authorisation from the qualified professional \nthey wish to recruit, an employer can support their \nfuture skilled worker by initiating the fast-track \nprocedure with the competent Foreigners Author-\nity in Germany. This new procedure is optional – \nqualified professionals can continue to enter Ger-\nmany via the regular visa procedure.\nManfred Inden, Director of Eiffage \nInfra-Nordwest GmbH:\n“We made use of the fast-track \nprocedure. It saved us about six \nmonths compared to using the \nstandard procedure for recruiting \nfrom a third country.”']","Employers in Germany can use the fast-track procedure for skilled workers. They can initiate this process with the competent Foreigners Authority to recruit qualified professionals from abroad, provided they have a specific offer of employment and a letter of authorization from the professional they intend to hire.","Skilled workers with non-academic vocational qualification.Skilled workers with professional experience.Skilled workers, entering the country for qualification measures for professional recognition oras part of a recognition partnership.Apprentices in a company-based vocational training programmeVocational school students, if they are able to demonstrate that employment will follow once they have completed their school-based vocational training",1.0,0.0,0.0,1200,90,5,1,True
